index,url,valid,domain,title,description,image,published,archive,content,quote,language,keyword
https://www.tagesschau.de/wirtschaft/unternehmen/energiesparen-events-beleuchtung-101.html,https://www.tagesschau.de/wirtschaft/unternehmen/energiesparen-events-beleuchtung-101.html,0,www.tagesschau.de,Events in der Energiekrise: Licht an oder aus?,"Für die Veranstaltungsbranche kommen Energiespardebatten zur Unzeit. Die Inflation trifft sie hart, der nächste Pandemie-Winter steht bevor - und jetzt soll auch noch das Licht aus bleiben.<em> Von Stephan Lenhardt.</em>",https://www.tagesschau.de/multimedia/bilder/dom-dunkel-101~_v-original.jpg,2022-10-02T06:59:31Z,https://web.archive.org/web/20221002070030/http://www.tagesschau.de/wirtschaft/unternehmen/energiesparen-events-beleuchtung-101.html,"Für die Veranstaltungsbranche kommen Energiespardebatten zur Unzeit. Die Inflation trifft sie hart, der nächste Pandemie-Winter steht bevor - und jetzt soll auch noch das Licht aus bleiben.
""Gerade … [+4392 chars]",,de,'Winter'
https://www.tagesschau.de/inland/gesellschaft/skigebiete-103.html,https://www.tagesschau.de/inland/gesellschaft/skigebiete-103.html,0,www.tagesschau.de,Energiepreise: Eingeschränktes Skivergnügen,"Seilbahnen, die langsamer fahren, weniger Beschneiung - und erhöhte Ticketpreise: Die Skigebiete in Deutschland bereiten sich auf einen harten Winter vor. Für Skifahrer bedeutet das Einschränkungen. <em>Von Eva Macht und Ina Held.</em>",https://www.tagesschau.de/multimedia/bilder/feldberg-119~_v-original.jpg,2022-10-03T05:18:05Z,https://web.archive.org/web/20221003051828/http://www.tagesschau.de/inland/gesellschaft/skigebiete-103.html,"Seilbahnen, die langsamer fahren, weniger Beschneiung - und erhöhte Ticketpreise: Die Skigebiete in Deutschland bereiten sich auf einen harten Winter vor. Für Skifahrer bedeutet das Einschränkungen. … [+3748 chars]",,de,'Winter'
https://www.chip.de/news/Heizkosten-senken-Die-besten-Ofenventilatoren_184442133.html,https://www.chip.de/news/Heizkosten-senken-Die-besten-Ofenventilatoren_184442133.html,0,www.chip.de,Heizkosten senken: Die besten Ofenventilatoren,"Heizen kann in diesem Herbst und Winter zu einer bösen Kostenfalle werden. Ein Ofenventilator kann Ihnen dabei helfen, Heizkosten zu sparen und trotzdem das Heim schön warm zu halten.",https://www.chip.de/ii/1/2/6/6/7/2/5/7/7/ofenventilatoren-60020e1313356b1e.jpg,2022-10-03T14:15:00Z,https://web.archive.org/web/20221003174600/https://www.chip.de/news/Heizkosten-senken-Die-besten-Ofenventilatoren_184442133.html,"<td>
 Abmessungen 
</td><td>
 16 x 11,5 x 21,5 Zentimeter
</td><td>
 21 x 12,5 x 23 Zentimeter
</td><td>
 20,2 x 17,4 x 11,2 Zentimeter
</td><td>
 22,1 x 17 x 9,1 Zentimeter
</td>",,de,'Winter'
https://www.welt.de/wirtschaft/article241399811/Energiekrise-EU-Kommission-bereitet-Europa-auf-Blackouts-im-Winter-vor.html,https://www.welt.de/wirtschaft/article241399811/Energiekrise-EU-Kommission-bereitet-Europa-auf-Blackouts-im-Winter-vor.html,0,www.welt.de,EU-Kommission bereitet Europa auf Blackouts im Winter vor,Die EU-Kommission bereitet sich auf Stromausfälle und andere Notlagen auch innerhalb der Europäischen Union vor. Zwei konkrete Szenarien hat man dabei im Blick. Zur deutschen Gaspreisbremse hat man in Brüssel noch Fragen.,https://img.welt.de/img/wirtschaft/mobile241399831/6841359787-ci16x9-w1200/317629634.jpg,2022-10-04T05:20:00Z,https://web.archive.org/web/20221004055438/https://www.welt.de/wirtschaft/article241399811/Energiekrise-EU-Kommission-bereitet-Europa-auf-Blackouts-im-Winter-vor.html,"Angesichts des Ukraine-Krieges und der Energiekrise hält die EU-Kommission Stromausfälle und andere Notlagen innerhalb der EU für möglich. Es ist gut möglich, dass Katastrophenhilfe auch innerhalb de… [+3056 chars]",,de,'Winter'
https://www.nzz.ch/wissenschaft/klimawandel-studie-extreme-duerre-in-europa-alle-20-jahre-ld.1706262,https://www.nzz.ch/wissenschaft/klimawandel-studie-extreme-duerre-in-europa-alle-20-jahre-ld.1706262,0,www.nzz.ch,Klimawandel-Studie: Extreme Dürre in Europa alle 20 Jahre zu erwarten,Teile Europas haben einen beispiellosen Dürresommer erlebt. Schon mit dem heutigen Stand des Klimawandels muss der Kontinent damit nun alle 20 Jahre rechnen. Doch die Erde heizt sich weiter auf.,"https://img.nzz.ch/2022/10/07/d1b8064a-e3c7-41b6-a23e-983e35153e7e.jpeg?width=1200&height=675&fit=bound&quality=75&auto=webp&crop=1920,1080,x0,y0&wmark=nzz",2022-10-07T02:54:28Z,https://web.archive.org/web/20221007031538/https://www.nzz.ch/wissenschaft/klimawandel-studie-extreme-duerre-in-europa-alle-20-jahre-ld.1706262,"Die Forscher können belegen, dass durch den Klimawandel verursachte höhere Temperaturen zu den weit verbreiteten Dürren in diesem Sommer geführt haben.
Als Folge des Klimawandels müssen West- und Mi… [+3339 chars]",,de,'Dürre'
https://steiermark.orf.at/stories/3177070/,https://steiermark.orf.at/stories/3177070/,0,steiermark.orf.at,19 Grad: Niemand soll frieren,"Um Energie zu sparen, empfiehlt die EU ihren Mitgliedern, im kommenden Winter die Temperatur in öffentlichen Innenräumen auf 19 Grad zu senken. Auch in der Steiermark soll gespart werden, aber zugleich soll niemand zum Frieren gezwungen werden.",https://ibs.orf.at/stm?image=https%3A%2F%2Foekastatic.orf.at%2Fmims%2F2022%2F41%2F32%2Fcrops%2Fw%3D1200%2Ch%3D627%2Cq%3D75%2F1528157_master_556832_b018d372-a3f4-4037-9a90-76fc477e09be.jpg%3Fs%3D09367941673ace25cbf452e0f7777e6eb48fdc4e,2022-10-07T16:53:00Z,https://web.archive.org/web/20221007172219/https://steiermark.orf.at/stories/3177070/,Auf maximal 19 Grad soll die Temperatur in Büros und Gebäuden nach dem Notfallplan der EU gesenkt werden. So strikt will man beim Land Steiermark aber nicht vorgehen ein Regierungsbeschluss gibt als … [+1839 chars],,de,'Winter'
https://www.zeit.de/news/2022-10/08/spd-chefin-deutschland-kommt-trotz-gaskrise-durch-winter,https://www.zeit.de/news/2022-10/08/spd-chefin-deutschland-kommt-trotz-gaskrise-durch-winter,0,www.zeit.de,Energiekrise: SPD-Chefin: Deutschland kommt trotz Gaskrise durch Winter,,,2022-10-08T00:15:43Z,,"When browsing with ads:
We collect personal data and also transmit it to third-party providers
 that help us improve and finance our digital content. Some of the information stored on your device, … [+732 chars]",,de,'Winter'
https://www.bild.de/news/wetter/wetter/herrlich-herbstlich-der-goldene-oktober-sonnt-sich-weiter-81554758.bild.html,https://www.bild.de/news/wetter/wetter/herrlich-herbstlich-der-goldene-oktober-sonnt-sich-weiter-81554758.bild.html,0,www.bild.de,Herrlich herbstlich - Der goldene Oktober geht in die Verlängerung!,"Schönster Sonnenschein, immer über 20 Grad. Was für einen wunderschönen goldenen Oktober können wir gerade genießen! Hoch Timeo gibt alles: Herbstwetter ...","https://images.bild.de/63412d5b487de368f3659fdf/dc273268f16d678c125e714ecc8151c2,1280a423?w=1280",2022-10-08T09:47:54Z,https://web.archive.org/web/20221008120144/https://www.bild.de/news/wetter/wetter/herrlich-herbstlich-der-goldene-oktober-sonnt-sich-weiter-81554758.bild.html,"Schönster Sonnenschein, immer über 20 Grad. Was für einen wunderschönen goldenen Oktober können wir gerade genießen! Hoch Timeo gibt alles: Herbstwetter für Ausflüge und Wanderungen.
Die Höchstwerte… [+1294 chars]",,de,'Herbst'
https://www.zeit.de/news/2022-10/09/hochschulen-wollen-diesen-winter-in-praesenz-lehren,https://www.zeit.de/news/2022-10/09/hochschulen-wollen-diesen-winter-in-praesenz-lehren,0,www.zeit.de,Hochschulen: Hochschulen wollen diesen Winter in Präsenz lehren,,,2022-10-09T07:27:57Z,https://web.archive.org/web/20221011075700/https://www.zeit.de/news/2022-10/09/hochschulen-wollen-diesen-winter-in-praesenz-lehren,"When browsing with ads:
We collect personal data and also transmit it to third-party providers
 that help us improve and finance our digital content. Some of the information stored on your device, … [+732 chars]",,de,'Winter'
https://www.welt.de/wirtschaft/article241496529/Proteste-Teure-Energie-drohende-Rezession-Trifft-die-Krise-den-Osten-haerter.html,https://www.welt.de/wirtschaft/article241496529/Proteste-Teure-Energie-drohende-Rezession-Trifft-die-Krise-den-Osten-haerter.html,0,www.welt.de,"Teure Energie, drohende Rezession – Trifft die Krise den Osten härter?",Der „Heiße Herbst“ von links und rechts zündet vor allem bei vielen Menschen im Osten. Sie sehen sich in der Krise besonders hart getroffen. Ökonomen sagen: Einige Fakten sprechen dagegen.,https://img.welt.de/img/newsticker/dpa_nt/infoline_nt/wirtschaft_nt/mobile241496197/2121358407-ci16x9-w1200/Demonstration-in-Halle.jpg,2022-10-09T09:18:20Z,https://web.archive.org/web/20221009093230/https://www.welt.de/wirtschaft/article241496529/Proteste-Teure-Energie-drohende-Rezession-Trifft-die-Krise-den-Osten-haerter.html,"Knappes Gas, teurer Sprit, steigende Preise für Brot und Butter: Krisenstimmung herrscht fast überall im Land, aber im Osten noch mehr als im Westen. Tausende protestieren jede Woche montags in Schwe… [+5791 chars]",,de,'Herbst'
https://www.focus.de/politik/deutschland/experte-warnt-deutsche-sollten-sich-auf-einen-strom-blackout-vorbereiten_id_162210200.html,https://www.focus.de/politik/deutschland/experte-warnt-deutsche-sollten-sich-auf-einen-strom-blackout-vorbereiten_id_162210200.html,0,www.focus.de,Experte warnt - Deutsche sollten sich auf einen Strom-Blackout vorbereiten,"Das Risiko eines Stromausfalls in Deutschland in diesem Winter ist gering. Doch ein Blackout ist auch nicht völlig auszuschließen. Der Chef des Medizinischen Katastrophen-Hilfswerks rät deshalb, sich auf einen möglichen Blackout vorzubereiten.",https://p6.focus.de/img/fotos/id_152134018/stromversorgung-blackout.jpg?im=Crop%3D%280%2C288%2C3464%2C1732%29%3BResize%3D%281200%2C627%29&hash=85fff1662e924bbb6764b3f0bb88cc98cba9b3a035be64232d123482f6bc0172,2022-10-09T14:34:37Z,https://web.archive.org/web/20221009151155/https://www.focus.de/politik/deutschland/experte-warnt-deutsche-sollten-sich-auf-einen-strom-blackout-vorbereiten_id_162210200.html,"Das Risiko eines Stromausfalls in Deutschland in diesem Winter ist gering. Doch ein Blackout ist auch nicht völlig auszuschließen. Der Chef des Medizinischen Katastrophen-Hilfswerks rät deshalb, sich… [+2218 chars]",,de,'Winter'
https://www.wiwo.de/technologie/forschung/unkonventionelles-fracking-mehr-als-zwei-billionen-kubikmeter-hier-kann-deutschland-gas-fracken/28728304.html,https://www.wiwo.de/technologie/forschung/unkonventionelles-fracking-mehr-als-zwei-billionen-kubikmeter-hier-kann-deutschland-gas-fracken/28728304.html,0,www.wiwo.de,Unkonventionelles Fracking: Mehr als zwei Billionen Kubikmeter: Hier kann Deutschland Gas fracken,"Die Gasvorräte werden knapp, der Winter steht kurz bevor. Eine, wenn auch sehr umstrittene, Lösung ist Fracking – denn Deutschland weist Billionen von Kubikmetern an Gas auf. Eine Übersicht auf der Deutschlandkarte.",https://www.wiwo.de/images/imago0117100511h/28728386/3-format11240.jpg,2022-10-10T04:00:00Z,https://web.archive.org/web/20221010091149/http://www.wiwo.de/technologie/forschung/unkonventionelles-fracking-mehr-als-zwei-billionen-kubikmeter-hier-kann-deutschland-gas-fracken/28728304.html,"Bei der Frage, wo Gas herkommt, kommen schnell Staaten wie die USA, Saudi-Arabien, Katar und natürlich Russland zur Sprache. Dabei könnte Gas in Deutschland vor der eigenen Haustür gefördert werden z… [+7453 chars]",,de,'Winter'
https://www.morgenpost.de/politik/inland/article236646081/Schaeubles-Spartipp-Dann-zieht-man-halt-einen-Pullover-an.html,https://www.morgenpost.de/politik/inland/article236646081/Schaeubles-Spartipp-Dann-zieht-man-halt-einen-Pullover-an.html,0,www.morgenpost.de,Energiekrise: Schäubles Spartipp: «Dann zieht man halt einen Pullover an»,Wie kommt man durch den kalten Winter? Dazu gibt es immer wieder Energiespartipps. Auch Wolfgang Schäuble hat einen parat.,https://img.morgenpost.de/img/inland/crop236646079/3452603125-w820-cv16_9-q85/Wolfgang-Schaeuble.jpg,2022-10-11T12:50:01Z,https://web.archive.org/web/20221011135205/https://www.morgenpost.de/politik/inland/article236646081/Schaeubles-Spartipp-Dann-zieht-man-halt-einen-Pullover-an.html,Berlin. Baden-Württembergs Regierungschef Winfried Kretschmann hat zum Energiesparen jüngst Waschlappen statt Dusche empfohlen - nun hat auch der 80-jährige CDU-Politiker Wolfgang Schäuble einen Tipp… [+1648 chars],,de,'Winter'
https://www.welt.de/politik/deutschland/article241541367/Wolfgang-Schaeuble-Blanker-Hohn-Kritik-an-seinen-Energiespartipps.html,https://www.welt.de/politik/deutschland/article241541367/Wolfgang-Schaeuble-Blanker-Hohn-Kritik-an-seinen-Energiespartipps.html,0,www.welt.de,„Blanker Hohn“ – Kritik an Schäubles Energiespartipps,"„Dann zieht man halt einen Pullover an. Oder vielleicht noch einen zweiten Pullover. Darüber muss man nicht jammern“, rät Wolfgang Schäuble den Deutschen für diesen Winter. Linken-Fraktionschef bezeichnet die Äußerungen des CDU-Politikers als „blanken Hohn“.",https://img.welt.de/img/politik/deutschland/mobile241542123/0441356427-ci16x9-w1200/GERMANY-POLAND-POLITICS-AWARD.jpg,2022-10-11T13:07:22Z,https://web.archive.org/web/20221011131308/https://www.welt.de/politik/deutschland/article241541367/Wolfgang-Schaeuble-Blanker-Hohn-Kritik-an-seinen-Energiespartipps.html,Baden-Württembergs Regierungschef Winfried Kretschmann (Grüne) hat zum Energiesparen jüngst Waschlappen statt Dusche empfohlen nun hat auch der 80-jährige CDU-Politiker Wolfgang Schäuble einen Tipp p… [+1477 chars],,de,'Winter'
https://www.zeit.de/zeit-magazin/leben/2022-10/winterkleidung-anziehsachen-zwiebelprinzip-energiekrise-energiesparen,https://www.zeit.de/zeit-magazin/leben/2022-10/winterkleidung-anziehsachen-zwiebelprinzip-energiekrise-energiesparen,0,www.zeit.de,Winterkleidung: Es wird ein Zwiebelwinter,"Der Absatz von Wollpullis und Thermowäsche steigt. Dabei liegt in den Schränken genug Kleidung zum Übereinandertragen. Wer Energie sparen will, lässt das Shoppen bleiben.",,2022-10-11T14:01:20Z,https://web.archive.org/web/20221011142237/https://www.zeit.de/zeit-magazin/leben/2022-10/winterkleidung-anziehsachen-zwiebelprinzip-energiekrise-energiesparen,"When browsing with ads:
We collect personal data and also transmit it to third-party providers
 that help us improve and finance our digital content. Some of the information stored on your device, … [+732 chars]",,de,'Winter'
https://www.focus.de/politik/deutschland/schaeubles-winter-tipps-dann-zieht-man-eben-mal-einen-pullover-an-darueber-muss-man-nicht-jammern_id_163153263.html,https://www.focus.de/politik/deutschland/schaeubles-winter-tipps-dann-zieht-man-eben-mal-einen-pullover-an-darueber-muss-man-nicht-jammern_id_163153263.html,0,www.focus.de,Schäuble über kalten Winter: „Dann zieht man eben mal einen Pullover an“ - FOCUS online,"CDU-Politiker Wolfgang Schäuble bereitet die Deutschen auf einen harten Winter ein. Wenn es mal kalt werde, „zieht man eben mal einen Pullover an“. Zugleich beklagt Schäuble die sinkende Arbeitsmoral.  ",https://p6.focus.de/img/regional/baden-wuerttemberg/id_163154356/wolfgang-schaeuble.jpg?im=Crop%3D%280%2C170%2C2048%2C1024%29%3BResize%3D%281200%2C627%29&hash=06029f565f130ad1f32040c88ea931d291e43a4e63e48161bfad9fb0dff6d293,2022-10-11T14:25:54+02:00,https://web.archive.org/web/20221011054044/https://www.focus.de/politik/deutschland/schaeubles-winter-tipps-dann-zieht-man-eben-mal-einen-pullover-an-darueber-muss-man-nicht-jammern_id_163153263.html,,,de,'Winter'
https://www.t-online.de/nachrichten/deutschland/innenpolitik/id_100064790/olaf-scholz-bundeskanzler-irritiert-mit-aussage-zu-russischem-gas.html,https://www.t-online.de/nachrichten/deutschland/innenpolitik/id_100064790/olaf-scholz-bundeskanzler-irritiert-mit-aussage-zu-russischem-gas.html,0,www.t-online.de,Olaf Scholz: Bundeskanzler irritiert mit Aussage zu russischem Gas - t-online,"<ol><li>Olaf Scholz: Bundeskanzler irritiert mit Aussage zu russischem Gas  t-online
</li><li>Operation „Kalter Winter“: Scholz mit unfassbarer Aussage zu Putins Gas-Erpressung | Ukraine-Krieg  BILD
</li><li>Maschinenbaugipfel: Doppelpass  FAZ - Frankfurter…",https://images.t-online.de/2022/10/zWK4SRkiFk0o/579x756:985x554/fit-in/1800x0/image.jpg,2022-10-12T07:55:25Z,https://web.archive.org/web/20221012080155/https://www.t-online.de/nachrichten/deutschland/innenpolitik/id_100064790/olaf-scholz-bundeskanzler-irritiert-mit-aussage-zu-russischem-gas.html,"Die Ostseepipeline Nord Stream 2 sorgte schon vor Inbetriebnahme für reichlich Diskussionen. Kanzler Scholz hat nun über seine früheren Bedenken gesprochen.
Bundeskanzler 
Olaf Scholz hat beim Masc… [+1349 chars]",,de,'Winter'
https://www.freitag.de/autoren/pep/im-gassektor-gibt-es-eine-verwirrende-mischung-von-plan-und-marktwirtschaft,https://www.freitag.de/autoren/pep/im-gassektor-gibt-es-eine-verwirrende-mischung-von-plan-und-marktwirtschaft,0,www.freitag.de,Winter | Planmarktexperimente: Der Gassektor in der Kriegswirtschaft,"Was bedeuten eigentlich die Füllstände der Speicher? Wer bekommt das Gas? Und ist genug für alle da? So sieht es also aus, wenn in einer Marktwirtschaft der Markt gewaltig aus dem Tritt kommt. Oder ist es schon Planwirtschaft, was die Bundesregierung in den v…",https://www.freitag.de/autoren/pep/im-gassektor-gibt-es-eine-verwirrende-mischung-von-plan-und-marktwirtschaft/@@images/social_image,2022-10-12T13:55:00Z,https://web.archive.org/web/20221012141623/https://www.freitag.de/autoren/pep/im-gassektor-gibt-es-eine-verwirrende-mischung-von-plan-und-marktwirtschaft,"So sieht es also aus, wenn in einer Marktwirtschaft der Markt gewaltig aus dem Tritt kommt. Oder ist es schon Planwirtschaft, was die Bundesregierung in den vergangenen Wochen und Monaten auf dem Gas… [+4743 chars]",,de,'Winter'
https://www.n-tv.de/wirtschaft/Deutschland-erreicht-Gasspeicher-Ziel-vorzeitig-article23647224.html,https://www.n-tv.de/wirtschaft/Deutschland-erreicht-Gasspeicher-Ziel-vorzeitig-article23647224.html,0,www.n-tv.de,Im Schnitt zu 95 Prozent gefüllt: Deutschland erreicht Gasspeicher-Ziel vorzeitig,"95 Prozent bis zum 1. November: Dieses Ziel gibt die Ampel bei der Befüllung der Gasspeicher vor, um gut durch den Winter zu kommen. Obwohl Russland nicht mehr liefert, ist dieser Meilenstein nun erreicht - und das mehr als zwei Wochen vor Ende des Monats.",https://bilder2.n-tv.de/img/incoming/crop23647225/8681324702-cImg_16_9-w1200/8c4f4e8b77cbe1b86ae1ba41e5b3bb15.jpg,2022-10-13T02:14:22Z,https://web.archive.org/web/20221013021737/https://www.n-tv.de/wirtschaft/Deutschland-erreicht-Gasspeicher-Ziel-vorzeitig-article23647224.html,"95 Prozent bis zum 1. November: Dieses Ziel gibt die Ampel bei der Befüllung der Gasspeicher vor, um gut durch den Winter zu kommen. Obwohl Russland nicht mehr liefert, ist dieser Meilenstein nun err… [+1711 chars]",,de,'Winter'
https://www.wiwo.de/unternehmen/energie/energiekrise-gasspeicher-fuellstand-erreicht-95-prozent/28746206.html,https://www.wiwo.de/unternehmen/energie/energiekrise-gasspeicher-fuellstand-erreicht-95-prozent/28746206.html,0,www.wiwo.de,Energiekrise: Gasspeicher-Füllstand erreicht 95 Prozent,"Deutschlands Gasspeicher sind fast komplett gefüllt. Die Menge würde rechnerisch ausreichen, um den Bedarf von zwei Wintermonaten zu decken. Das reiche also bei weitem noch nicht aus, sagt ein Behördenchef.",https://www.wiwo.de/images/gasspeicher/28746202/2-format11240.jpg,2022-10-14T07:26:28Z,,"Deutschlands Gasspeicher sind zu mehr als 95 Prozent gefüllt. Binnen 24 Stunden stieg der Füllstand um 0,17 Punkte auf 95,14 Prozent, wie aus Angaben von Europas Gasinfrastruktur-Betreibern hervorgin… [+4830 chars]",,de,'Winter'
https://www.n-tv.de/wirtschaft/Wie-lange-reicht-das-Gas-article23651548.html,https://www.n-tv.de/wirtschaft/Wie-lange-reicht-das-Gas-article23651548.html,0,www.n-tv.de,Speicher füllen sich: Wie lange reicht das Gas?,"Die Gasspeicher sind prall gefüllt, obwohl der Kreml die Lieferungen nach Deutschland gestoppt hat. Doch die Vorräte alleine reichen nicht aus, um durch den Winter zu kommen.",https://bilder3.n-tv.de/img/incoming/crop23651630/2771329829-cImg_16_9-w1200/imago0170014525h.jpg,2022-10-14T13:30:08Z,https://web.archive.org/web/20221014133228/https://www.n-tv.de/wirtschaft/Wie-lange-reicht-das-Gas-article23651548.html,"Die Gasspeicher sind prall gefüllt, obwohl der Kreml die Lieferungen nach Deutschland gestoppt hat. Doch die Vorräte alleine reichen nicht aus, um durch den Winter zu kommen.
Der Winter naht, die de… [+4349 chars]",,de,'Winter'
https://www.focus.de/finanzen/news/gasspeicher-in-deutschland-sind-voll-2023-wird-es-schwieriger-werden_id_164892896.html,https://www.focus.de/finanzen/news/gasspeicher-in-deutschland-sind-voll-2023-wird-es-schwieriger-werden_id_164892896.html,0,www.focus.de,"Russland, China, Niederlande - Drei Gründe, warum es 2023 schwieriger wird, Deutschlands Gasspeicher zu füllen","Deutschland vermeldet zu 95 Prozent gefüllte Erdgasspeicher, zwei Wochen vor der selbst gesetzten Deadline. Für den Winter 2022/2023 sind wir damit gut vorbereitet, aber das Kunststück im kommenden Jahr zu wiederholen, könnte schwer werden.Von FOCUS-online-Au…",https://p6.focus.de/img/fotos/id_156394342/nord-stream-74572937.jpg?im=Crop%3D%280%2C251%2C3529%2C1764%29%3BResize%3D%281200%2C627%29&impolicy=perceptual&quality=medium&hash=a8f6630d7b4869af81f6cf2b7047d10b013da959e849f0ad14fce14c9ee53dbf,2022-10-14T13:35:49Z,https://web.archive.org/web/20221014134044/https://www.focus.de/finanzen/news/gasspeicher-in-deutschland-sind-voll-2023-wird-es-schwieriger-werden_id_164892896.html,"Deutschland vermeldet zu 95 Prozent gefüllte Erdgasspeicher, zwei Wochen vor der selbst gesetzten Deadline. Für den Winter 2022/2023 sind wir damit gut vorbereitet, aber das Kunststück im kommenden J… [+6637 chars]",,de,'Winter'
https://www.sueddeutsche.de/politik/waermehalle-kaelte-winter-hilfe-heizkosten-1.5674899,https://www.sueddeutsche.de/politik/waermehalle-kaelte-winter-hilfe-heizkosten-1.5674899,0,www.sueddeutsche.de,Wärmehallen für den Winter: Wenn die Wohnung nicht mehr warm wird,"Die Gasspeicher sind gut gefüllt - aber was, wenn Heizen für Menschen mit wenig Geld einfach zu teuer wird? Zuflucht könnten Orte bieten, die aus Nachkriegszeiten bekannt sind.",https://www.sueddeutsche.de/image/sz.1.5674902/1200x675?v=1665755696,2022-10-14T13:55:01Z,https://web.archive.org/web/20221014135644/https://www.sueddeutsche.de/politik/waermehalle-kaelte-winter-hilfe-heizkosten-1.5674899,"Die Gasspeicher sind gut gefüllt - aber was, wenn Heizen für Menschen mit wenig Geld einfach zu teuer wird? Zuflucht könnten Orte bieten, die aus Nachkriegszeiten bekannt sind.Es gibt ein Bild der Kü… [+414 chars]",,de,'Winter'
https://www.handelsblatt.com/politik/international/russlands-angriffskrieg-ukrainische-stromexporte-in-die-eu-sind-eingebrochen/28747752.html,https://www.handelsblatt.com/politik/international/russlands-angriffskrieg-ukrainische-stromexporte-in-die-eu-sind-eingebrochen/28747752.html,0,www.handelsblatt.com,Russlands Angriffskrieg: Ukrainische Stromexporte in die EU sind eingebrochen,"Putins Militär hat die ukrainische Energieinfrastruktur stark beschädigt. Statt weiterhin zu exportieren, steht das Land im Winter womöglich selbst ohne Strom da.",https://www.handelsblatt.com/images/folgen-eines-russischen-raketenangriffs-/28748138/3-format2003.jpg,2022-10-15T10:00:00Z,https://web.archive.org/web/20221015100518/https://www.handelsblatt.com/politik/international/russlands-angriffskrieg-ukrainische-stromexporte-in-die-eu-sind-eingebrochen/28747752.html,"Wien Als die russische Armee am vergangenen Montag damit begann, die gesamte Ukraineverstärkt mit Raketen zu beschießen, schien das ein ziemlich wahlloses Unterfangen zu sein. Aber die Russen verfolg… [+6286 chars]",,de,'Winter'
https://www.n-tv.de/politik/politik_kommentare/Wo-ist-die-Bruecke-fuer-den-Winter-article23651703.html,https://www.n-tv.de/politik/politik_kommentare/Wo-ist-die-Bruecke-fuer-den-Winter-article23651703.html,0,www.n-tv.de,Gaspreisbremse reicht nicht: Wo ist die Brücke für den Winter?,"Die Empfehlungen der Gaskommission müssen nachgebessert werden. Kleine und mittlere Unternehmen brauchen eine Übergangslösung für den Winter, mindestens aber eine Härtefallbrücke.",https://bilder1.n-tv.de/img/incoming/crop23651724/2261328986-cImg_16_9-w1200/319309847.jpg,2022-10-16T12:25:59Z,https://web.archive.org/web/20221016123240/https://www.n-tv.de/politik/politik_kommentare/Wo-ist-die-Bruecke-fuer-den-Winter-article23651703.html,"Die Empfehlungen der Gaskommission müssen nachgebessert werden. Kleine und mittlere Unternehmen brauchen eine Übergangslösung für den Winter, mindestens aber eine Härtefallbrücke.
""Bei uns läuft der… [+6247 chars]",,de,'Winter'
https://www.sueddeutsche.de/politik/frankreich-demonstration-marsch-gegen-das-teure-leben-inflation-energiekrise-la-france-insoumise-1.5676022,https://www.sueddeutsche.de/politik/frankreich-demonstration-marsch-gegen-das-teure-leben-inflation-energiekrise-la-france-insoumise-1.5676022,0,www.sueddeutsche.de,Demonstration in Paris: Stresstest,"In Frankreich ist die Inflationsrate vergleichsweise niedrig, trotzdem ruft die Linke zum ""Marsch gegen das teure Leben"" auf. Der Auftakt zu einem heißen Herbst?",https://www.sueddeutsche.de/image/sz.1.5676023/1200x675?v=1665931805,2022-10-16T14:50:13Z,,"In Frankreich ist die Inflationsrate vergleichsweise niedrig, trotzdem ruft die Linke zum ""Marsch gegen das teure Leben"" auf. Der Auftakt zu einem heißen Herbst?Wenn es nach Jean-Luc Mélenchon, dem G… [+6545 chars]",,de,'Herbst'
